<!DOCTYPE elements SYSTEM "elements.dtd">
<elements>
	<element>
		<operation name="Движение вправо" />
		<objects>
			<object name="материальная точка" id="#ID-1">
				<links>
					<link name="position" value="#ID-2" />
				</links>
			</object>
			<object name="точка" id="#ID-2">
				<attributes>
					<attribute name="occupied" type="boolean" value="true" />
				</attributes>
				<links>
					<link name="right-neighbor" value="#ID-3" />
					<link name="position" value="#ID-1" />
				</links>
			</object>
			<object name="точка" id="#ID-3">
				<attributes>
					<attribute name="occupied" type="boolean" value="false" />
				</attributes>
				<links>
					<link name="left-neighbor" value="#ID-2" />
				</links>
			</object>
		</objects>
		<transformations>
			<transformation type="linkUpdate" id="#ID-1"
				name="position" value="#ID-3" />
			<transformation type="linkUpdate" id="#ID-2"
				name="position" value="" />
			<transformation type="linkUpdate" id="#ID-3"
				name="position" value="#ID-1" />
			<transformation type="valueUpdate" id="#ID-2"
				name="occupied" value="false" />
			<transformation type="valueUpdate" id="#ID-3"
				name="occupied" value="true" />
		</transformations>
	</element>
	<element>
		<operation name="Движение влево" />
		<objects>
			<object name="материальная точка" id="#ID-1">
				<links>
					<link name="position" value="#ID-3" />
				</links>
			</object>
			<object name="точка" id="#ID-2">
				<attributes>
					<attribute name="occupied" type="boolean" value="false" />
				</attributes>
				<links>
					<link name="right-neighbor" value="#ID-3" />
				</links>
			</object>
			<object name="точка" id="#ID-3">
				<attributes>
					<attribute name="occupied" type="boolean" value="true" />
				</attributes>
				<links>
					<link name="left-neighbor" value="#ID-2" />
					<link name="position" value="#ID-1" />
				</links>
			</object>
		</objects>
		<transformations>
			<transformation type="linkUpdate" id="#ID-1"
				name="position" value="#ID-2" />
			<transformation type="linkUpdate" id="#ID-2"
				name="position" value="#ID-1" />
			<transformation type="linkUpdate" id="#ID-3"
				name="position" value="" />
			<transformation type="valueUpdate" id="#ID-2"
				name="occupied" value="true" />
			<transformation type="valueUpdate" id="#ID-3"
				name="occupied" value="false" />
		</transformations>
	</element>
</elements>
